Institution,Country/territory
Cornwall Archaeological Unit,United Kingdom (UK)
East Dorset Antiquarian Society (EDAS),United Kingdom (UK)
Craven Museum and Gallery,United Kingdom (UK)
The Orkney Museum,United Kingdom (UK)
Keswick Museum,United Kingdom (UK)
Swale and Thames Archaeological Survey Company (SWAT Archaeology),United Kingdom (UK)
Hampshire Cultural Trust,United Kingdom (UK)
Manx National Heritage,United Kingdom (UK)
Tees Archaeology,United Kingdom (UK)
Heritage and Archaeological Research Practice Limited (HARP),United Kingdom (UK)
The Salisbury Museum,United Kingdom (UK)
Wiltshire Museum,United Kingdom (UK)
Royal Cornwall Museum,United Kingdom (UK)
Leeds Museum Discovery Centre,United Kingdom (UK)
MOLES Archaeology,United Kingdom (UK)
Museum of London,United Kingdom (UK)
The Novium Museum,United Kingdom (UK)
The Dock Museum,United Kingdom (UK)
Guernsey Museums and Galleries,United Kingdom (UK)
National Museum of Wales,United Kingdom (UK)
Royal Pavilion and Museums Trust,United Kingdom (UK)
Geophiz.Biz Limited,United Kingdom (UK)
Lower Winskill Farm,United Kingdom (UK)
Future-Fit Foundation,United Kingdom (UK)
Middlesex University (MU),United Kingdom (UK)
East Lancashire Hospitals NHS Trust,United Kingdom (UK)
Achilles Therapeutics plc,United Kingdom (UK)
Basildon and Thurrock University Hospitals NHS Foundation Trust,United Kingdom (UK)
Flamingo Land Ltd.,United Kingdom (UK)
North East London NHS Foundation Trust (NELFT),United Kingdom (UK)
Berkshire Healthcare NHS Foundation Trust,United Kingdom (UK)
Gloucestershire Hospitals NHS Trust (GHNHSFT),United Kingdom (UK)
Norfolk County Council,United Kingdom (UK)
East Suffolk and North Essex NHS Foundation Trust,United Kingdom (UK)
UCLPartners Academic Health Science Partnership,United Kingdom (UK)
Electronic Medical Records for The Developing World (Emr4dw),United Kingdom (UK)
Modestum LTD,United Kingdom (UK)
Harvard University,United States of America (USA)
Stanford University,United States of America (USA)
Massachusetts Institute of Technology (MIT),United States of America (USA)
National Institutes of Health (NIH),United States of America (USA)
"University of California, Berkeley (UC Berkeley)",United States of America (USA)
University of Michigan (U-M),United States of America (USA)
Yale University,United States of America (USA)
"University of California, San Diego (UC San Diego)",United States of America (USA)
"University of California, Los Angeles (UCLA)",United States of America (USA)
Columbia University in the City of New York (CU),United States of America (USA)
Cornell University,United States of America (USA)
University of Pennsylvania (Penn),United States of America (USA)
Northwestern University (NU),United States of America (USA)
University of Washington (UW),United States of America (USA)
Princeton University,United States of America (USA)
California Institute of Technology (Caltech),United States of America (USA)
The University of Chicago (UChicago),United States of America (USA)
The University of Texas at Austin (UT Austin),United States of America (USA)
Johns Hopkins University (JHU),United States of America (USA)
Washington University in St. Louis (WUSTL),United States of America (USA)
University of Illinois at Urbana-Champaign (UIUC),United States of America (USA)
New York University (NYU),United States of America (USA)
University of Wisconsin-Madison (UW-Madison),United States of America (USA)
"University of California, San Francisco (UCSF)",United States of America (USA)
University of Minnesota (UMN),United States of America (USA)
"University of California, Santa Barbara (UCSB)",United States of America (USA)
The Pennsylvania State University (Penn State),United States of America (USA)
Duke University,United States of America (USA)
Lawrence Berkeley National Laboratory (LBNL),United States of America (USA)
University of Colorado Boulder (CU-Boulder),United States of America (USA)
Georgia Institute of Technology (Georgia Tech),United States of America (USA)
"University of California, Davis (UC Davis)",United States of America (USA)
The Ohio State University (OSU),United States of America (USA)
"University of California, Irvine (UCI)",United States of America (USA)
Texas A&M University (TAMU),United States of America (USA)
"University of Maryland, College Park (UMCP)",United States of America (USA)
The University of Texas Southwestern Medical Center (UT Southwestern Medical Center),United States of America (USA)
The University of North Carolina at Chapel Hill (UNC),United States of America (USA)
University of Pittsburgh (Pitt),United States of America (USA)
University of Southern California (USC),United States of America (USA)
Purdue University,United States of America (USA)
"Rutgers, The State University of New Jersey (RU)",United States of America (USA)
Vanderbilt University (VU),United States of America (USA)
Indiana University (IU),United States of America (USA)
Rice University,United States of America (USA)
"University of California, Riverside (UCR)",United States of America (USA)
University of Florida (UF),United States of America (USA)
Scripps Research,United States of America (USA)
National Aeronautics and Space Administration (NASA),United States of America (USA)
North Carolina State University (NCSU),United States of America (USA)
State University of New York at Stony Brook (SUNY Stony Brook),United States of America (USA)
The University of Arizona (Arizona),United States of America (USA)
Los Alamos National Laboratory (LANL),United States of America (USA)
Argonne National Laboratory (ANL),United States of America (USA)
Arizona State University (ASU),United States of America (USA)
Mount Sinai Health System (MSHS),United States of America (USA)
University of Virginia (UVA),United States of America (USA)
The University of Utah (Utah),United States of America (USA)
Michigan State University (MSU),United States of America (USA)
Brown University,United States of America (USA)
Oak Ridge National Laboratory (ORNL),United States of America (USA)
Baylor College of Medicine (BCM),United States of America (USA)
The University of Texas MD Anderson Cancer Center,United States of America (USA)
Emory University,United States of America (USA)
Memorial Sloan Kettering Cancer Center (MSKCC),United States of America (USA)
Pacific Northwest National Laboratory (PNNL),United States of America (USA)
The Rockefeller University,United States of America (USA)
University of Massachusetts Amherst (UMass Amherst),United States of America (USA)
National Institute of Standards and Technology (NIST),United States of America (USA)
Boston University (BU),United States of America (USA)
Colorado State University,United States of America (USA)
U.S. Department of Defense (DoD),United States of America (USA)
University of Rochester (UR),United States of America (USA)
Mayo Clinic,United States of America (USA)
"University of California, Santa Cruz (UCSC)",United States of America (USA)
Iowa State University,United States of America (USA)
Carnegie Mellon University (CMU),United States of America (USA)
University of Massachusetts Medical School (UMass Medical School),United States of America (USA)
Virginia Polytechnic Institute and State University (Virginia Tech),United States of America (USA)
The University of Iowa (UI),United States of America (USA)
University of Oregon (UO),United States of America (USA)
Brookhaven National Laboratory (BNL),United States of America (USA)
National Oceanic and Atmospheric Administration (NOAA),United States of America (USA)
University of Illinois at Chicago (UIC),United States of America (USA)
University of Delaware (UD),United States of America (USA)
University of Cincinnati (UC),United States of America (USA)
University of Hawai'i at Manoa (UH Mānoa),United States of America (USA)
University of Notre Dame (ND),United States of America (USA)
Albert Einstein College of Medicine (Einstein),United States of America (USA)
The City University of New York (CUNY),United States of America (USA)
University of Connecticut (UConn),United States of America (USA)
University of Colorado Anschutz Medical Campus (CU Anschutz),United States of America (USA)
Florida State University (FSU),United States of America (USA)
U.S. Geological Survey (USGS),United States of America (USA)
"University at Buffalo, The State University of New York (SUNY UB)",United States of America (USA)
Northeastern University (NEU),United States of America (USA)
St. Jude Children's Research Hospital (St. Jude),United States of America (USA)
Dartmouth College,United States of America (USA)
The University of Georgia (UGA),United States of America (USA)
Oregon Health and Science University (OHSU),United States of America (USA)
Lawrence Livermore National Laboratory (LLNL),United States of America (USA)
University of Houston (UH),United States of America (USA)
National Center for Atmospheric Research (NCAR),United States of America (USA)
The University of Tennessee at Knoxville (UTK),United States of America (USA)
Case Western Reserve University (CWRU),United States of America (USA)
The University of Oklahoma (OU),United States of America (USA)
Sandia National Laboratories,United States of America (USA)
Fred Hutchinson Cancer Research Center (FHCRC),United States of America (USA)
University of Nebraska-Lincoln (UNL),United States of America (USA)
University of South Carolina - Columbia (SC),United States of America (USA)
Oregon State University,United States of America (USA)
The University of Texas at Dallas (UT Dallas),United States of America (USA)
Tufts University,United States of America (USA)
The University of New Mexico (UNM),United States of America (USA)
University of Miami (UM),United States of America (USA)
Brandeis University,United States of America (USA)
Washington State University (WSU),United States of America (USA)
University of Kentucky (UK),United States of America (USA)
IBM Corporation,United States of America (USA)
University of Missouri (Mizzou),United States of America (USA)
Alphabet Inc.,United States of America (USA)
The University of Texas Health Science Center at Houston (UTHealth),United States of America (USA)
Temple University,United States of America (USA)
Salk Institute for Biological Studies (Salk),United States of America (USA)
The University of Alabama at Birmingham (UAB),United States of America (USA)
The University of Kansas (KU),United States of America (USA)
"Merck & Co., Inc.",United States of America (USA)
Smithsonian Institution,United States of America (USA)
HHMI Janelia Research Campus,United States of America (USA)
University of South Florida (USF),United States of America (USA)
U.S. Department of Veterans Affairs,United States of America (USA)
"University of Nevada, Reno (UNR)",United States of America (USA)
"University of Maryland, Baltimore (UMB)",United States of America (USA)
Institute for Advanced Study (IAS),United States of America (USA)
Boston College (BC),United States of America (USA)
Carnegie Institution for Science (CIS),United States of America (USA)
State University of New York at Albany (SUNY Albany),United States of America (USA)
University of Texas Medical Branch (UTMB),United States of America (USA)
Woods Hole Oceanographic Institution (WHOI),United States of America (USA)
Clemson University,United States of America (USA)
The University of Texas at San Antonio (UTSA),United States of America (USA)
Cold Spring Harbor Laboratory (CSHL),United States of America (USA)
Wayne State University,United States of America (USA)
National Renewable Energy Laboratory (NREL),United States of America (USA)
University of Central Florida (UCF),United States of America (USA)
Auburn University,United States of America (USA)
The George Washington University (GW),United States of America (USA)
Louisiana State University (LSU),United States of America (USA)
Rensselaer Polytechnic Institute (RPI),United States of America (USA)
Cleveland Clinic,United States of America (USA)
The University of Akron (UAkron),United States of America (USA)
Simons Foundation,United States of America (USA)
Children's Hospital of Philadelphia (CHOP),United States of America (USA)
City of Hope,United States of America (USA)
Wake Forest University (WFU),United States of America (USA)
Pfizer Inc.,United States of America (USA)
U.S. Environmental Protection Agency (EPA),United States of America (USA)
The University of Texas Health Science Center at San Antonio (UT Health San Antonio),United States of America (USA)
Georgia State University (GSU),United States of America (USA)
Georgetown University,United States of America (USA)
Virginia Commonwealth University (VCU),United States of America (USA)
Tulane University,United States of America (USA)
The University of Alabama (UA),United States of America (USA)
University of Rhode Island (URI),United States of America (USA)
Fermi National Accelerator Laboratory (Fermilab),United States of America (USA)
Utah State University (USU),United States of America (USA)
Thomas Jefferson University (TJU),United States of America (USA)
Texas Tech University (TTU),United States of America (USA)
Syracuse University,United States of America (USA)
U.S. Department of Agriculture (USDA),United States of America (USA)
Lehigh University,United States of America (USA)
Chan Zuckerberg Biohub (CZ Biohub),United States of America (USA)
"University of Nevada, Las Vegas (UNLV)",United States of America (USA)
Cedars-Sinai Medical Center (Cedars-Sinai),United States of America (USA)
Colorado School of Mines,United States of America (USA)
"University of California, Merced (UC Merced)",United States of America (USA)
University of North Texas (UNT),United States of America (USA)
University of Vermont (UVM),United States of America (USA)
West Virginia University (WVU),United States of America (USA)
Florida International University (FIU),United States of America (USA)
University of Pittsburgh Medical Center (UPMC),United States of America (USA)
Allen Institute,United States of America (USA)
Gladstone Institutes,United States of America (USA)
The Jackson Laboratory (JAX),United States of America (USA)
University of Louisville (UofL),United States of America (USA)
"Regeneron Pharmaceuticals, Inc.",United States of America (USA)
University of Wyoming,United States of America (USA)
Thermo Fisher Scientific Inc.,United States of America (USA)
La Jolla Institute for Immunology (LJI),United States of America (USA)
Montana State University,United States of America (USA)
The University of Texas at Arlington (UTA),United States of America (USA)
Stowers Institute for Medical Research,United States of America (USA)
Sanford Burnham Prebys Medical Discovery Institute (SBP),United States of America (USA)
Drexel University,United States of America (USA)
University of Alabama in Huntsville (UAH),United States of America (USA)
George Mason University (GMU),United States of America (USA)
University of Alaska Fairbanks (UAF),United States of America (USA)
Kansas State University (K-State),United States of America (USA)
The University of Toledo (UT),United States of America (USA)
Bristol-Myers Squibb (BMS),United States of America (USA)
Brigham Young University (BYU),United States of America (USA)
University of New Hampshire (UNH),United States of America (USA)
University of Arkansas (UARK),United States of America (USA)
Johnson & Johnson,United States of America (USA)
University of Montana (UMT),United States of America (USA)
University of Nebraska Medical Center (UNMC),United States of America (USA)
Kent State University,United States of America (USA)
Baylor University,United States of America (USA)
Van Andel Research Institute (VAI),United States of America (USA)
Medical College of Wisconsin (MCW),United States of America (USA)
AbbVie Inc.,United States of America (USA)
Seattle Children's Hospital,United States of America (USA)
Saint Louis University (SLU),United States of America (USA)
Thomas Jefferson National Accelerator Facility (TJNAF),United States of America (USA)
Medical University of South Carolina (MUSC),United States of America (USA)
The Wistar Institute,United States of America (USA)
Mississippi State University,United States of America (USA)
U.S. Food and Drug Administration (USFDA),United States of America (USA)
Amgen Inc.,United States of America (USA)
University of Denver,United States of America (USA)
H. Lee Moffitt Cancer Center & Research Institute,United States of America (USA)
"University of Maryland, Baltimore County (UMBC)",United States of America (USA)
DowDuPont Inc.,United States of America (USA)
Old Dominion University (ODU),United States of America (USA)
Northern Arizona University (NAU),United States of America (USA)
Southern Methodist University (SMU),United States of America (USA)
Oklahoma State University,United States of America (USA)
Miami University,United States of America (USA)
The University of Texas at El Paso (UTEP),United States of America (USA)
Microsoft Corporation,United States of America (USA)
Santa Fe Institute (SFI),United States of America (USA)
Marquette University,United States of America (USA)
The University of Maine (UMaine),United States of America (USA)
University of Idaho,United States of America (USA)
Michigan Technological University (Michigan Tech),United States of America (USA)
New Jersey Institute of Technology (NJIT),United States of America (USA)
Missouri University of Science and Technology (MST),United States of America (USA)
Exxon Mobil Corporation (ExxonMobil),United States of America (USA)
Ohio University (Ohio),United States of America (USA)
State University of New York at Binghamton (SUNY Binghamton),United States of America (USA)
Johns Hopkins Health System Corporation (JHHS),United States of America (USA)
"California State University, Northridge (CSUN)",United States of America (USA)
non-affiliated author contributions,United States of America (USA)
University of Massachusetts Boston (UMass Boston),United States of America (USA)
Southwest Research Institute (SwRI),United States of America (USA)
The College of William & Mary (W&M),United States of America (USA)
University of Mississippi (Ole Miss),United States of America (USA)
New Mexico Institute of Mining and Technology (NMT),United States of America (USA)
San Diego State University (SDSU),United States of America (USA)
"Moderna, Inc.",United States of America (USA)
Clarkson University,United States of America (USA)
Houston Methodist,United States of America (USA)
Rush University,United States of America (USA)
American Museum of Natural History (AMNH),United States of America (USA)
Ludwig Cancer Research,United States of America (USA)
State University of New York College at Buffalo (SUNY Buffalo State),United States of America (USA)
Augusta University,United States of America (USA)
Boise State University,United States of America (USA)
California Institute for Quantitative Biosciences (QB3),United States of America (USA)
University of Massachusetts Lowell (UMass Lowell),United States of America (USA)
"Leidos Holdings, Inc.",United States of America (USA)
Waters Corporation,United States of America (USA)
University of Wisconsin-Milwaukee (UWM),United States of America (USA)
U.S. Department of Health and Human Services (HHS),United States of America (USA)
Roswell Park Cancer Institute (RPCI),United States of America (USA)
North Dakota State University (NDSU),United States of America (USA)
Stevens Institute of Technology,United States of America (USA)
Bruker Corporation,United States of America (USA)
"Vir Biotechnology, Inc.",United States of America (USA)
"23andMe, Inc.",United States of America (USA)
University of North Carolina at Charlotte (UNC Charlotte),United States of America (USA)
Northwell Health,United States of America (USA)
New York Genome Center (NYGC),United States of America (USA)
Stanford Health Care,United States of America (USA)
Illinois State University,United States of America (USA)
Portland State University (PSU),United States of America (USA)
Florida Atlantic University (FAU),United States of America (USA)
Loyola University Chicago (LUC),United States of America (USA)
State University of New York Upstate Medical University (SUNY Upstate Medical University),United States of America (USA)
"New England Biolabs, Inc. (NEB)",United States of America (USA)
Planetary Science Institute (PSI),United States of America (USA)
University of Arkansas for Medical Sciences (UAMS),United States of America (USA)
East Carolina University (ECU),United States of America (USA)
University of Tennessee Health Science Center (UTHSC),United States of America (USA)
Illinois Institute of Technology (IIT),United States of America (USA)
University of Colorado Denver (CU Denver),United States of America (USA)
"Ionis Pharmaceuticals, Inc.",United States of America (USA)
Joint Genome Institute (JGI),United States of America (USA)
New Mexico State University (NMSU),United States of America (USA)
Nevada System of Higher Education (NSHE),United States of America (USA)
Monterey Bay Aquarium Research Institute (MBARI),United States of America (USA)
University of South Dakota (USD),United States of America (USA)
Eli Lilly and Company,United States of America (USA)
Bowling Green State University (BGSU),United States of America (USA)
National Science Foundation (NSF),United States of America (USA)
University of North Dakota (UND),United States of America (USA)
Institute for Systems Biology (ISB),United States of America (USA)
"Science Systems and Applications, Inc. (SSAI)",United States of America (USA)
Stanford Children's Health,United States of America (USA)
University of Southern Mississippi (USM),United States of America (USA)
Universities Space Research Association (USRA),United States of America (USA)
New York State Department of Health (NYSDOH),United States of America (USA)
Claremont Colleges,United States of America (USA)
Wesleyan University,United States of America (USA)
San Jose State University (SJSU),United States of America (USA)
Albany Medical Center,United States of America (USA)
"Gilead Sciences, Inc.",United States of America (USA)
Texas Biomedical Research Institute (Texas Biomed),United States of America (USA)
Children's National Health System,United States of America (USA)
Buck Institute for Research on Aging,United States of America (USA)
The University of Memphis (U of M),United States of America (USA)
Oakland University,United States of America (USA)
Field Museum of Natural History,United States of America (USA)
University of North Carolina at Wilmington (UNCW),United States of America (USA)
"Southern Illinois University, Carbondale (SIU)",United States of America (USA)
University of South Alabama,United States of America (USA)
University of North Carolina at Greensboro,United States of America (USA)
Florida Institute of Technology (Florida Tech),United States of America (USA)
Space Telescope Science Institute (STScI),United States of America (USA)
Rosalind Franklin University of Medicine and Science (RFUMS),United States of America (USA)
Intel Corporation,United States of America (USA)
Kennesaw State University (KSU),United States of America (USA)
University of Missouri-Kansas City (UMKC),United States of America (USA)
Western Washington University (WWU),United States of America (USA)
National Bureau of Economic Research (NBER),United States of America (USA)
"Bioqual, Inc.",United States of America (USA)
Idaho National Laboratory (INL),United States of America (USA)
University of Louisiana at Lafayette (UL Lafayette),United States of America (USA)
San Francisco State University (SF State),United States of America (USA)
Uniformed Services University of the Health Sciences,United States of America (USA)
Texas Christian University (TCU),United States of America (USA)
California Polytechnic State University (Cal Poly),United States of America (USA)
Connecticut Agricultural Experiment Station (CAES),United States of America (USA)
Texas Tech University Health Sciences Center (TTUHSC),United States of America (USA)
Central Michigan University,United States of America (USA)
Benaroya Research Institute at Virginia Mason (BRI),United States of America (USA)
South Dakota State University,United States of America (USA)
"NorthWest Research Associates, Inc. (NWRA)",United States of America (USA)
Catholic University of America (CUA),United States of America (USA)
Corning Incorporated,United States of America (USA)
Biogen Inc.,United States of America (USA)
Rowan University,United States of America (USA)
HudsonAlpha Institute for Biotechnology,United States of America (USA)
Kaiser Permanente,United States of America (USA)
Hackensack Meridian Health,United States of America (USA)
South Dakota School of Mines and Technology (SDSMT),United States of America (USA)
Northern Illinois University (NIU),United States of America (USA)
"Atmospheric and Environmental Research, Inc. (AER)",United States of America (USA)
St. John's University,United States of America (USA)
Worcester Polytechnic Institute (WPI),United States of America (USA)
Rochester Institute of Technology (RIT),United States of America (USA)
Wright State University,United States of America (USA)
New York-Presbyterian Hospital,United States of America (USA)
Smith College,United States of America (USA)
HRL Laboratories LLC,United States of America (USA)
Villanova University,United States of America (USA)
Henry M. Jackson Foundation for the Advancement of Military Medicine (HJF),United States of America (USA)
Versiti Blood Research Institute,United States of America (USA)
