Institution,Country/territory
Telemark Hospital Skien,Norway
Bjørknes College,Norway
Norwegian Institute for Agricultural and Environmental Research (Bioforsk),Norway
Norwegian Forest and Landscape Institute (NFLI),Norway
Norwegian Mapping Authority,Norway
Nofima AS,Norway
Northern Research Institute (Norut),Norway
Norwegian Institute for Cultural Heritage Research (NIKU),Norway
Norwegian Coastal Administration (NCA),Norway
Norwegian School of Sport Sciences (NSSS),Norway
Innlandet Hospital Trust,Norway
Fonna Hospital Trust,Norway
Norwegian National Advisory Unit on Ageing and Health (Ageing and Health),Norway
Vestfold Hospital Trust,Norway
BI Norwegian Business School,Norway
Telenor Group,Norway
Kristian Gerhard Jebsen Foundation,Norway
Kristiania University College,Norway
University of Nizwa,Oman
Sultan Qaboos University (SQU),Oman
University of Technology and Applied Sciences-Salalah (UTAS - Salalah),Oman
University of Technology and Applied Sciences (Higher College of Technology) in Muscat,Oman
Alara Resources Ltd.,Oman
Oman Ministry of Health,Oman
University of Technology and Applied Sciences-Nizwa (UTAS-Nizwa),Oman
Oman Water Society,Oman
Middle East Desalination Research Center (MEDRC),Oman
University of the Punjab,Pakistan
Lahore University of Management Sciences (LUMS),Pakistan
University of Management and Technology (UMT),Pakistan
COMSATS University Islamabad (CUI),Pakistan
Quaid-i-Azam University (QAU),Pakistan
National University of Sciences and Technology (NUST),Pakistan
"University of Agriculture, Faisalabad (UAF)",Pakistan
"Government College University, Lahore (GCU)",Pakistan
University of Peshawar,Pakistan
University of Central Punjab (UCP),Pakistan
National University of Computer and Emerging Sciences (NUCES),Pakistan
National University of Technology (NUTECH),Pakistan
National Textile University (NTU),Pakistan
Pakistan Atomic Energy Commission (PAEC),Pakistan
Aga Khan University (AKU),Pakistan
University of Karachi,Pakistan
Islamia University of Bahawalpur Pakistan (IUB),Pakistan
Higher Education Commission of Pakistan (HEC),Pakistan
Children's Hospital and the Institute of Child Health,Pakistan
Mehran University of Engineering and Technology (MUET),Pakistan
University of Health Sciences Lahore,Pakistan
University of Kotli Azad Jammu and Kashmir (UOK),Pakistan
Khwaja Fareed University of Engineering and Information Technology (KFUEIT),Pakistan
University of Sahiwal,Pakistan
University of Baluchistan,Pakistan
Ayub Agriculture Research Institute (AARI),Pakistan
Institute of Development and Economic Alternatives (IDEAS),Pakistan
Pak-Austria Fachhochschule: Institute of Applied Sciences and Technology,Pakistan
University of Mianwali (UMW),Pakistan
National Institute of Health,Pakistan
Riphah International University,Pakistan
Shaheed Zulfiqar Ali Bhutto Medical University (SZABMU),Pakistan
University of Sindh,Pakistan
University of Haripur (UoH),Pakistan
Information Technology University (ITU),Pakistan
Abbottabad University of Science and Technology (AUST),Pakistan
Gomal University,Pakistan
Punjab Police,Pakistan
Centre for Economic Research in Pakistan (CERP),Pakistan
University of Engineering and Technology - Lahore (UET Lahore),Pakistan
National University of Medical Sciences (NUMS),Pakistan
Hazara University,Pakistan
Islamabad Model College for Boys (IMCB),Pakistan
University of Gujrat (UOG),Pakistan
DHA Suffa University (DSU),Pakistan
Nur International University,Pakistan
Center for Non-Communicable Diseases (CNCD),Pakistan
Dow University of Health Sciences (DUHS),Pakistan
"Abdul Wali Khan University, Mardan (AWKUM)",Pakistan
Foundation University Islamabad (FUI),Pakistan
University of Lahore (UOL),Pakistan
non-affiliated author contributions,Pakistan
Ziauddin University,Pakistan
Fatima Memorial Hospital (FMH),Pakistan
Air University,Pakistan
Faisalabad Institute of Cardiology,Pakistan
Afro-Asian Institute (AAI),Pakistan
Institute of Mother and Child Care in the city Multan,Pakistan
"Children Hospital and Institute of Child Health, Multan",Pakistan
University of Veterinary and Animal Sciences - Lahore (UVAS),Pakistan
Al-Shifa Trust Eye Hospital,Pakistan
Coral Reef Research Foundation (CRRF),Palau
Palau International Coral Reef Center (PICRC),Palau
Birzeit University,Palestinian territories
Al-Quds University,Palestinian territories
Bethlehem University,Palestinian territories
Al Makassed Islamic Charitable Society Hospital,Palestinian territories
Palestinian Medical Complex,Palestinian territories
An-Najah National University,Palestinian territories
University of Panama,Panama
The Gorgas Memorial Institute for Health Studies (GMI),Panama
Coiba Scientific Station (COIBA AIP),Panama
Autonomous University of Chiriqui (UNACHI),Panama
Patronato Panamá Viejo,Panama
"Secretaría Nacional de Ciencia, Tecnología e Innovación (SENACYT)",Panama
Institute for Scientific Research and High Technology Services (INDICASAT-AIP),Panama
Vaxtrials S.A.,Panama
Ministry of Health of Panama (MINSA),Panama
Institute of Medical Sciences (ICM),Panama
The New Guinea Binatang Research Center,Papua New Guinea
University of Papua New Guinea (UPNG),Papua New Guinea
Papua New Guinea National Museum and Art Gallery (NMAG),Papua New Guinea
Lihir Medical Centre,Papua New Guinea
non-affiliated author contributions,Papua New Guinea
University of Goroka,Papua New Guinea
Consejo Nacional de Ciencia y Tecnología (CONACYT),Paraguay
Universidad Nacional de Asuncion (UNA),Paraguay
Insituto Saite,Paraguay
Guyra Paraguay,Paraguay
Parque Ecológico La Asunción,Paraguay
Paraguay Ministry of Public Health and Social Welfare (MSPBS),Paraguay
Pontifical Catholic University of Peru (PUCP),Peru
Cayetano Heredia University (UPCH),Peru
National University of San Antonio Abad in Cuzco (UNSAAC),Peru
Instituto del Mar del Perú (IMARPE),Peru
National University of San Marcos (UNMSM),Peru
Pro Delphinus,Peru
Peru Ministry of Health (MINSA),Peru
Instituto Nacional de Investigación en Glaciares y Ecosistemas de Montaña (INAIGEM),Peru
Asociación Civil Impacta Salud y Educación,Peru
Universidad Continental,Peru
Peruvian University of Applied Sciences (UPC),Peru
Universidad Nacional de la Amazonía Peruana (UNAP),Peru
Minsur S.A.,Peru
Ministerio del Ambiente (MINAM),Peru
Instituto del Bien Común (IBC),Peru
Instituto Nacional de Salud (INS),Peru
Instituto de Investigaciones de la Amazonía Peruana (IIAP),Peru
Catholic University of Santa María,Peru
National University of Engineering (UNI),Peru
Servicio Nacional de Meteorología e Hidrología del Perú (Senamhi),Peru
Intelfin Estudios y Consultoria S.A.C.,Peru
Instituto Geográfico Nacional del Perú (IGN),Peru
Universidad Científica del Perú (UCP),Peru
Universidad Privada San Juan Bautista (UPSJB),Peru
Center for the Development of the Amazonian Indigenous (CEDIA),Peru
Center for Conservation Research and Management of Protected Areas (CIMA),Peru
Universidad Nacional de Piura,Peru
Instituto de Investigación en Ecología y Conservación (IIECOO),Peru
Jardín Botánico de Missouri (JBM),Peru
Edgardo Rebagliati Martins National Hospital,Peru
National University of Saint Augustine (UNSA),Peru
University of Engineering and Technology (UTEC),Peru
Jorge Basadre Grohmann National University (UNJBG),Peru
SPL Operaciones Botánicos Peruanos SCRL,Peru
Autoridad Regional Ambiental Loreto (ARA L.),Peru
Naturaleza y Cultura Internacional,Peru
Centro de Ornitología y Biodiversidad (Corbidi),Peru
National University of the Center of Peru (UNCP),Peru
Centro Peruano para la Biodiversidad y Conservación,Peru
Universidad de Huánuco (UDH),Peru
Instituto Nacional de Innovación Agraria (INIA),Peru
National Agrarian University (UNALM),Peru
Universidad Nacional Intercultural de la Amazonía (UNIA),Peru
Museo de Sitio Huaca Pucllana,Peru
Redes Peru,Peru
University of the Philippines Diliman (UPD),Philippines
International Rice Research Institute (IRRI),Philippines
National Research Council of the Philippines (NRCP),Philippines
University of Science and Technology of Southern Philippines (USTP),Philippines
National Museum of the Philippines,Philippines
Cordillera Exploration Company Incorporated.,Philippines
University of the Philippines Los Baños (UPLB),Philippines
University of the Philippines Manila (UPM),Philippines
Manila Observatory,Philippines
Visayas State University (VSU),Philippines
"Pontifical and Royal University of Santo Tomas, The Catholic University of the Philippines (UST)",Philippines
University of the Philippines Mindanao (UP Mindanao),Philippines
Ateneo de Manila University (AMU),Philippines
University of San Carlos (USC),Philippines
Iligan Institute of Technology of the Mindanao State University (MSU-IIT),Philippines
Chong Hua Hospital,Philippines
University of the Philippines Visayas (UPV),Philippines
National Commission for Culture and the Arts (NCCA),Philippines
Jose R. Reyes Memorial Medical Center (JRRMMC),Philippines
Makati Medical Center,Philippines
Dumendingan Arts Guild Inc.,Philippines
Ayta Magbukon Indigenous Cultural Community,Philippines
Xavier University,Philippines
"Tarbilang Foundation, Inc.",Philippines
National Commission on Indigenous Peoples (NCIP),Philippines
Indigenous People's Mandatory Representative-Sangguniang Panlalawigan,Philippines
Negros Museum,Philippines
Talaandig Indigenous Cultural Community,Philippines
Surigaonon Heritage Center,Philippines
Cagayan State University,Philippines
Balangao Indigenous Cultural Community,Philippines
Department of Education Division of Bataan,Philippines
Mindanao State University,Philippines
Mindanao Doctors Hospital and Cancer Center Inc.,Philippines
Quirino State University,Philippines
Biliran Province State University (BiPSU),Philippines
José Rizal University,Philippines
"Nisa Ul Haqq fi Bangsamoro, Inc.",Philippines
Young Indigenous Peoples Empowered to Act in Community Engagement,Philippines
Provincial Government of Sarangani,Philippines
Subanen Indigenous Cultural Community,Philippines
Ateneo de Davao University,Philippines
Museo Dabawenyo,Philippines
"Kaliwat Performing Artists Collective, Inc.",Philippines
Butuan City Government,Philippines
Tagakaulo Indigenous Cultural Community,Philippines
"Kabankalan City Cultural and Tourism Foundation, Inc.",Philippines
Cuyonon Indigenous Cultural Community,Philippines
Agusan Manobo Indigenous Cultural Community,Philippines
Kalanguya Indigenous Cultural Community,Philippines
City Museum Of Cagayan de Oro,Philippines
Ifugao State University,Philippines
"Colegio San Agustin, Bacolod",Philippines
"Panaghiusa Alang Sa Kaugalingnan Ug Kalingkawasan, Inc.",Philippines
Panay Eco-Social Conservation Project (PanayCon),Philippines
Southern Leyte State University (SLSU),Philippines
Cavite State University,Philippines
De La Salle University (DLSU),Philippines
Philippine Institute for Development Studies (PIDS),Philippines
"Alliance for Improving Health Outcomes, Inc.",Philippines
Polish Academy of Sciences (PAS),Poland
University of Warsaw (UW),Poland
Jagiellonian University (UJ),Poland
Adam Mickiewicz University in Poznań (AMU),Poland
University of Wrocław (UWr),Poland
Wrocław University of Science and Technology (WRUT),Poland
National Centre for Nuclear Research (NCBJ),Poland
AGH University of Science and Technology (AGH UST),Poland
Nicolaus Copernicus University in Toruń (NCU),Poland
University of Silesia (US),Poland
Lodz University of Technology (TUL),Poland
Warsaw University of Technology (WUT),Poland
University of Gdańsk (UG),Poland
Gdańsk University of Technology (GUT),Poland
University of Lodz (UL),Poland
Silesian University of Technology (SUT),Poland
Medical University of Gdańsk (MUG),Poland
Wrocław University of Environmental and Life Sciences,Poland
University of Białystok (UWB),Poland
University of Szczecin (USZ),Poland
University of Zielona Góra (UZ),Poland
Poznan University of Technology (PUT),Poland
International Institute of Molecular and Cell Biology (IIMCB),Poland
Wroclaw Medical University,Poland
University of Social Sciences and Humanities (SWPS),Poland
Maria Curie-Skłodowska University (UMCS),Poland
Saule Technologies Ltd.,Poland
Maria Skłodowska Curie Memorial Cancer Centre and Institute of Oncology (MCMCC),Poland
National Research Institute (PIB),Poland
Siedlce University of Natural Sciences and Humanities,Poland
Tadeusz Kościuszko Cracow University of Technology (CUT),Poland
Medical University of Lublin,Poland
Poznan University of Medical Sciences (PUMS),Poland
Medical University of Warsaw (MUW),Poland
Rzeszów University of Technology,Poland
Warsaw University of Life Sciences (SGGW),Poland
Synthex Technologies Sp. z o.o.,Poland
West Pomeranian University of Technology (ZUT),Poland
Institute of Hematology and Transfusion Medicine (IHT),Poland
Photo HiTech Ltd.,Poland
The Jan Kochanowski University in Kielce (UJK),Poland
University of Agriculture in Krakow,Poland
Polish Center for Technology Development (PORT),Poland
Institute of Nuclear Chemistry and Technology (INCT),Poland
non-affiliated author contributions,Poland
Medical University of Białystok (UMB),Poland
Military University of Technology,Poland
Poznan Science and Technology Park of Adam Mickiewicz University Foundation (PPNT),Poland
University of Rzeszów,Poland
Opole University,Poland
Postgraduate School of Molecular Medicine (SMM),Poland
Saule Research Institute (SRI),Poland
Ryvu Therapeutics SA,Poland
Poznań University of Life Sciences (PULS),Poland
National Marine Fisheries Research Institute (NMFRI),Poland
Medical Centre of Postgraduate Education (CMKP),Poland
ProChimia Surfaces Sp. z o.o.,Poland
Medical University of Lodz (MUL),Poland
Forest Research Institute (IBL),Poland
TriMen Chemicals,Poland
Children's Memorial Health Institute (CMHI),Poland
National Institute of Cardiology,Poland
Copernicus Center for Interdisciplinary Studies,Poland
Maria Grzegorzewska University (APS),Poland
Społeczna Akademia Nauk,Poland
Institute of Natural Fibres and Medicinal Plants,Poland
Poznań University of Economics and Business (PUEB),Poland
ENSEMBLE3 Sp. z o. o,Poland
Micropress Europe,Poland
Medical University of Silesia (SUM),Poland
University of Warmia and Mazury in Olsztyn (UWM),Poland
Jan Długosz University,Poland
Centrum Onkologii KOMED,Poland
FutureSynthesis sp. z o.o.,Poland
Natura International Polska Foundation,Poland
Center of Medical Genetics GENESIS,Poland
Pedagogical University of Krakow (UP),Poland
Narodowy Instytut Onkologii,Poland
Foundry Research Institute (IOd),Poland
Institute of Biopolymers and Chemical Fibres,Poland
Packaging Research Institute (COBRO),Poland
Institute of Biopolymers and Chemical Fibres (IIMPiB),Poland
Institute of Precision Mechanics (IMP),Poland
Institute of Mechanised Construction and Rock Mining (IMBiGS),Poland
Industrial Chemistry Research Institute (ICRI),Poland
Institute of Welding,Poland
Institute of Non-Ferrous Metals in Gliwice (IMN),Poland
Institute of Ceramics and Building Materials (ICIMB),Poland
Institute of Advanced Manufacturing Technology (IOS),Poland
Stanislaw Staszic Institute for Ferrous Metallurgy (IMZ),Poland
"Institute of Heavy Organic Synthesis ""Blachownia"" (ISCO)",Poland
Institute of Leather Industry (IPS),Poland
Institute of Electrical Drives and Machines (KOMEL),Poland
New Chemical Syntheses Institute (INS),Poland
Institute of Industrial Organic Chemistry (IPO),Poland
Institute of Medical Technology and Equipment (ITAM),Poland
Institute of Organisation and Management in Industry (ORGMASZ),Poland
Poland Ministry of Economy,Poland
Tele and Radio Research Institute (ITR),Poland
Pharmaceutical Research Institute (PRI),Poland
Maksymilian Pluta Institute of Applied Optics (INOS),Poland
Industrial Institute of Agricultural Engineering (PIMR),Poland
Automotive Industry Institute (PIMOT),Poland
Institute of Innovative Technologies (EMAG),Poland
Institute for Sustainable Technologies (ITEE),Poland
Rail Vehicles Institute (TABOR),Poland
Industrial Research Institute for Automation and Measurements (PIAP),Poland
Metal Forming Institute (INOP),Poland
Institute of Electrical Engineering (IEL),Poland
Institute of Aviation,Poland
Institute of Logistics and Warehousing (ILiM),Poland
Institute of Electronic Materials Technology (ITME),Poland
Institute of Electron Technology (ITE),Poland
Wood Technology Institute (ITD),Poland
Textile Research Institute,Poland
Oculomedica Eye Research and Development Center,Poland
John Paul II Hospital,Poland
Institute of Plasma Physics and Laser Microfusion (IPPLM),Poland
Dobrostan,Poland
Central Laboratory for Radiological Protection (CLOR),Poland
National Research Institute of Mother and Child (NRIMC),Poland
Polish Society for the Protection of Birds (OTOP),Poland
National Institute of Public Health - National Institute of Hygiene (NIPH - NIH),Poland
National Medicines Institute,Poland
Foundation for Biodiversity Research,Poland
University of Physical Education in Krakow (AWF),Poland
Pomeranian Medical University (PMU),Poland
LUX MED Onkologia Sp. z o.o.,Poland
Polish State Forests,Poland
International Institute for Molecular Oncology (IIMO),Poland
Opole University of Technology (OUTech),Poland
John Paul II Catholic University of Lublin (KUL),Poland
Kraków University of Economics (UEK),Poland
Nofer Institute of Occupational Medicine (NIOM),Poland
University of Lisbon (ULISBOA),Portugal
University of Porto (UP),Portugal
New University of Lisbon (UNL),Portugal
University of Aveiro (UA),Portugal
University of Coimbra (UC),Portugal
Gulbenkian Science Institute (IGC),Portugal
University of Minho (UM),Portugal
Champalimaud Foundation,Portugal
International Iberian Nanotechnology Laboratory (INL),Portugal
Laboratory of Instrumentation and Experimental Particle Physics (LIP),Portugal
University of Beira Interior (UBI),Portugal
University of the Azores (UAç),Portugal
Instituto Português do Mar e da Atmosfera (IPMA),Portugal
University of Trás-os-Montes and Alto Douro (UTAD),Portugal
Centro Hospitalar do Porto (CH Porto),Portugal
Portuguese Oncology Institute (IPO),Portugal
University of Évora (UE),Portugal
Polytechnic Institute of Lisbon (IPL),Portugal
Hospital of St. John (CHSJ),Portugal
INESC Microsystems and Nanotechnologies (INESC MN),Portugal
ISCTE Lisbon University Institute (ISCTE-IUL),Portugal
University of Algarve (UAlg),Portugal
Institute of Molecular Medicine (IMM),Portugal
Catholic University of Portugal (UCP),Portugal
Tropical Research Institute (IICT),Portugal
Feedzai,Portugal
Hydrographic Institute (IH),Portugal
Polytechnic Institute of Leiria (IPLeiria),Portugal
Centro Hospitalar Lisboa Ocidental (CHLO),Portugal
"Portugal Telecom Inovação, S.A. (PTIn)",Portugal
ISPA - Instituto Universitário,Portugal
Instituto de Oftalmologia Dr Gama Pinto,Portugal
"Cooperativa de Ensino Superior Politécnico e Universitário (CESPU), CRL",Portugal
Displax S.A.,Portugal
Estrutura de Missão para a Extensão da Plataforma Continental (EMEPC),Portugal
"Bluepharma Indústria Farmacêutica, S.A.",Portugal
Institute of Experimental and Technological Biology (iBET),Portugal
Hospital CUF Porto,Portugal
"Eurotrials, Scientific Consultants, SA",Portugal
Hospital de Braga,Portugal
Comissão de Coordenação da Região Norte (CCDR-N),Portugal
Serviço de Utilização Comum dos Hospitais (SUCH),Portugal
Instituto Português do Sangue e da Transplantação (IPST),Portugal
Polytechnic Institute of Porto (IPP),Portugal
Centro de Reabilitação Profissional de Gaia (CRPG),Portugal
"Artur Salgado - Ortopedia, Lda.",Portugal
Centro Hospitalar de Vila Nova de Gaia/Espinho (CHVNG/E),Portugal
National Health Institute Doutor Ricardo Jorge (INSA),Portugal
Institute for Systems Engineering and Computers (INESC),Portugal
Institute for the Development of New Technologies (UNINOVA),Portugal
National Institute of Health Dr. Ricardo Jorge (INSA),Portugal
Portuguese Association for the Conservation of Grapevine Diversity (PORVID),Portugal
Biocant - Biotechnology Innovation Center,Portugal
Portugal Ministry of Health,Portugal
#NAME?,Portugal
Polytechnic Institute of Cávado and Ave (IPCA),Portugal
"Bioprospectum, Lda.",Portugal
Centre for Nanotechnology and Smart Materials (CeNTI),Portugal
Regional Government of the Azores,Portugal
Centro Hospitalar Lisboa Norte (CHULN),Portugal
Lusophone University of Humanities and Technologies (ULHT),Portugal
Magellan Biologics & Consulting,Portugal
Easy behavior,Portugal
Maternidade Dr. Alfredo da Costa,Portugal
Algarve Biomedical Center (ABC),Portugal
Hospital de São Teotónio,Portugal
Centro Hospitalar de Lisboa Central (EPE),Portugal
Polytechnic Institute of Coimbra,Portugal
Polytechnic Institute of Viseu (IPV),Portugal
Universidade Aberta,Portugal
Hamad Bin Khalifa University (HBKU),Qatar
Qatar University,Qatar
Sidra Medical and Research Center,Qatar
Hamad Medical Corporation (HMC),Qatar
Carnegie Mellon University in Qatar,Qatar
Qatar Ministry of Public Health (MOPH),Qatar
Qatar Foundation,Qatar
Qatar Science & Technology Park (QSTP),Qatar
Qatar Petroleum (QP),Qatar
Primary Health Care Corporation (PHCC),Qatar
Anti-Doping Laboratory Qatar (ADLQ),Qatar
Aspetar Hospital,Qatar
Qatar Falcon Genome Project,Qatar
University of La Réunion,Reunion
Centre Hospitalier Universitaire de La Réunion (CHU de La Réunion),Reunion
West University of Timișoara (UVT),Romania
Horia Hulubei National Institute of Physics and Nuclear Engineering (IFIN HH),Romania
Babeș-Bolyai University (UBB),Romania
University of Bucharest (UB),Romania
Romanian Academy,Romania
Institute of Space Science (ISS),Romania
National Institute of Materials Physics (NIMP),Romania
Alexandru Ioan Cuza University (UAIC),Romania
Romania Ministry of National Education,Romania
Ştefan cel Mare University of Suceava (USV),Romania
University of Oradea,Romania
Academy of Romanian Scientists (AOSR),Romania
"National Institute for Laser, Plasma and Radiation Physics (INFLPR)",Romania
University of Medicine and Pharmacy Craiova (UMF Craiova),Romania
Apollonia University,Romania
TVR Iaşi,Romania
non-affiliated author contributions,Romania
Transilvania University of Brașov (UniTBv),Romania
"Victor Babes University of Medicine and Pharmacy, Timisoara (UMFT)",Romania
Technical University of Cluj-Napoca,Romania
National Institute for Earth Physics (NIEP),Romania
Muzeul Olteniei Craiova,Romania
Dr. Victor Babeș Timișoara Infectious Diseases and Pneumophysiology Clinical Hospital,Romania
"National Institute of Infectious Diseases ""Prof. Dr. Matei Bals"" (INBIMB)",Romania
Institute of Public Health Bucharest (IPHB),Romania
Romanian research and Development Institute for Gas Turbines (COMOTI),Romania
"The Oncology Institute ""Prof. Dr. Ion Chiricuta"" (IOCN)",Romania
Spitalul Clinic de Boli Infecțioase Cluj-Napoca,Romania
Spitalul Clinic de Boli Infecţioase “Sfânta Parascheva” Iaşi,Romania
Centrul de Oncologie Sf Nectarie Craiova,Romania
Iuliu Hațieganu University of Medicine and Pharmacy (UMF Cluj),Romania
National Environmental Protection Agency (NEPA),Romania
Politehnica University of Bucharest (UPB),Romania
Romanian Institute of Science and Technology (RIST),Romania
National Institute of Research and Development for Biological Sciences (INCDSB),Romania
Spitalul Clinic Județean de Urgență Cluj-Napoca,Romania
National School of Political Science and Public Administration (SNSPA),Romania
National University of Theatre and Film I.L. Caragiale (UNATC),Romania
Bucharest University of Economic Studies,Romania
Carol Davila University of Medicine and Pharmacy (UMFCD),Romania
Alexandru Obregia Clinical Psychiatric Hospital,Romania
Center for Health Outcomes and Evaluation srl,Romania
National Institute of Legal Medicine Mina Minovici (NILM),Romania
Floreasca Hospital (SCUB),Romania
Cardio-aid,Romania
Russian Academy of Sciences (RAS),Russia
Lomonosov Moscow State University (MSU),Russia
Saint Petersburg State University (SPbU),Russia
National Research Center Kurchatov Institute (NRCKI),Russia
Moscow Institute of Physics and Technology - State University (MIPT),Russia
Skolkovo Institute of Science and Technology (Skoltech),Russia
ITMO National Research University (ITMO University),Russia
Joint Institute for Nuclear Research (JINR),Russia
National Research University Higher School of Economics (HSE),Russia
Novosibirsk State University (NSU),Russia
National Research Nuclear University MEPhI (Moscow Engineering Physics Institute),Russia
Tomsk State University (TSU),Russia
National University of Science and Technology (MISIS),Russia
Ural Federal University (UrFU),Russia
Kazan Federal University (KFU),Russia
Tomsk Polytechnic University (TPU),Russia
Saratov State University (SGU),Russia
Southern Federal University (SFedU),Russia
Russian Quantum Center (RQC),Russia
Lobachevsky State University of Nizhni Novgorod (UNN),Russia
Tomsk State Pedagogical University (TSPU),Russia
Saint-Petersburg Electrotechnical University (LETI),Russia
I.M. Sechenov First Moscow State Medical University (FMSMU),Russia
Peoples Friendship University of Russia (PFUR),Russia
Rosatom State Atomic Energy Corporation (Rosatom),Russia
Far Eastern Federal University (FEFU),Russia
Tomsk State University of Control Systems and Radioelectronics (TUSUR),Russia
Moscow Technological University (MIREA),Russia
Bashkir State Pedagogical University (BSPU),Russia
Siberian Federal University (SibFU),Russia
Peter the Great St. Petersburg Polytechnic University (SPbPU),Russia
TYDEX LLC,Russia
P.G. Demidov Yaroslavl State University,Russia
